{
  "$schema": "https://json-schema.org/draft/2020-12/schema",
  "title": "PluginReleasesManifest",
  "description": "One ROM per-plugin releases manifest",
  "type": "object",
  "required": ["version", "display_name", "description", "author", "source", "license", "latest", "releases"],
  "properties": {
    "version": {
      "description": "Manifest schema version - incremented on breaking changes",
      "type": "integer",
      "format": "uint32",
      "minimum": 0,
      "default": 1
    },
    "display_name": {
      "description": "Human-readable plugin name",
      "type": "string"
    },
    "description": {
      "description": "Short description of the plugin",
      "type": "string"
    },
    "author": {
      "description": "The plugin author's name or handle",
      "type": "string"
    },
    "source": {
      "description": "The repository the plugin is built from",
      "type": "string"
    },
    "license": {
      "description": "SPDX identifier of the plugin's license, e.g. MIT",
      "type": "string"
    },
    "latest": {
      "description": "Latest released version string, e.g. 0.1.0",
      "type": ["string", "null"]
    },
    "releases": {
      "description": "List of releases, newest first",
      "type": "array",
      "items": {
        "$ref": "#/$defs/PluginRelease"
      }
    }
  },
  "$defs": {
    "PluginRelease": {
      "description": "A single plugin release entry",
      "type": "object",
      "required": [
        "version", "path", "filename", "sha256",
        "api_version", "plugin_type", "min_fw_version"
      ],
      "properties": {
        "version": {
          "description": "Plugin version string, e.g. 0.1.0",
          "type": "string"
        },
        "path": {
          "description": "Relative path to version directory, e.g. v0.1.0",
          "type": "string"
        },
        "filename": {
          "description": "Binary filename within the version directory",
          "type": "string"
        },
        "sha256": {
          "description": "SHA256 hex digest of the binary",
          "type": "string",
          "pattern": "^[0-9a-f]{64}$"
        },
        "api_version": {
          "description": "Plugin API version this release targets",
          "type": "integer",
          "format": "uint32",
          "minimum": 1
        },
        "plugin_type": {
          "description": "Plugin type",
          "$ref": "#/$defs/PluginType"
        },
        "min_fw_version": {
          "description": "Minimum One ROM firmware version required to run this plugin (e.g. 0.6.7)",
          "type": "string"
        },
        "incompatible_from": {
          "description": "First One ROM firmware version this release is known to NOT work with, discovered after release. The compatibility window is half-open: [min_fw_version, incompatible_from). Absent means no known upper bound. Advisory: honoured by manifest-aware tooling (CLI) only, not enforced by firmware.",
          "type": "string"
        }
      }
    },
    "PluginType": {
      "description": "Plugin type enum",
      "type": "string",
      "enum": ["system", "user", "pio"]
    }
  }
}