{
  "version": 1,
  "display_name": "One ROM USB Throughput",
  "description": "Tests data throughput through One ROM's system USB plugin",
  "author": "Piers Finlayson",
  "source": "https://github.com/piersfinlayson/one-rom-usb-throughput-plugin",
  "license": "MIT",
  "latest": "0.2.0",
  "releases": [
    {
      "version": "0.2.0",
      "path": "v0.2.0",
      "filename": "plugin.bin",
      "sha256": "e8275990e3fc3d8f06cdd44eaa5ead7c6f1b22561a27c1e3ba4075ccf4b449ba",
      "api_version": 1,
      "plugin_type": "user",
      "min_fw_version": "0.8.0"
    },
    {
      "version": "0.1.1",
      "path": "v0.1.1",
      "filename": "plugin.bin",
      "sha256": "4f7864ec893589705bdb165816742dd171b03706602e836e853e42bec4c9cde4",
      "api_version": 1,
      "plugin_type": "user",
      "min_fw_version": "0.8.0"
    },
    {
      "version": "0.1.0",
      "path": "v0.1.0",
      "filename": "plugin.bin",
      "sha256": "b734f5b3dfc654f69e6a4fa318a513a7a12f3d7bed4f20ca72466a579e9afa61",
      "api_version": 1,
      "plugin_type": "user",
      "min_fw_version": "0.8.0"
    }
  ]
}