{
  "version": 1,
  "display_name": "Host Control of One ROM",
  "description": "Allows hosts to control One ROM using the ROM Bus Control Protocol",
  "author": "Piers Finlayson",
  "source": "https://github.com/piersfinlayson/one-rom",
  "license": "MIT",
  "latest": "0.1.6",
  "releases": [
    {
      "version": "0.1.6",
      "path": "v0.1.6",
      "filename": "plugin.bin",
      "sha256": "70362a27ee00349da9dc1a87f004cebef629d3bac36301c300b4ec6f7600ea41",
      "api_version": 1,
      "plugin_type": "user",
      "min_fw_version": "0.7.1"
    },
    {
      "version": "0.1.5",
      "path": "v0.1.5",
      "filename": "plugin.bin",
      "sha256": "43fcdc0745742dfc1a575cdfbbcc9728728743b02901865975dd33e51319e07a",
      "api_version": 1,
      "plugin_type": "user",
      "min_fw_version": "0.7.1"
    },
    {
      "version": "0.1.4",
      "path": "v0.1.4",
      "filename": "plugin.bin",
      "sha256": "9f7da9296a978eed24d745827e4bfcdac59229c06f4f25260d028fe1dd541ec9",
      "api_version": 1,
      "plugin_type": "user",
      "min_fw_version": "0.7.1"
    },
    {
      "version": "0.1.3",
      "path": "v0.1.3",
      "filename": "plugin.bin",
      "sha256": "c32abc9cd3c397b5f680ceed19737eeccbdb67955304139c62363d70bdf2aa36",
      "api_version": 1,
      "plugin_type": "user",
      "min_fw_version": "0.7.1"
    },
    {
      "version": "0.1.2",
      "path": "v0.1.2",
      "filename": "plugin.bin",
      "sha256": "09ca7f444b2acd4ecdeda0c0de5c0cc1e7fd8e3c6c6c58406255fdc978e41731",
      "api_version": 1,
      "plugin_type": "user",
      "min_fw_version": "0.7.1"
    },
    {
      "version": "0.1.1",
      "path": "v0.1.1",
      "filename": "plugin.bin",
      "sha256": "f80d22254e2a01037c9a47797b7df9b37379502e3cf16adcc82d8054e9d77708",
      "api_version": 1,
      "plugin_type": "user",
      "min_fw_version": "0.7.0"
    },
    {
      "version": "0.1.0",
      "path": "v0.1.0",
      "filename": "plugin.bin",
      "sha256": "eb7f3c5393bd9f291243f1fbe49fd85e39df73d05403821d740c5491c186e2de",
      "api_version": 1,
      "plugin_type": "user",
      "min_fw_version": "0.6.9",
      "incompatible_from": "0.7.0"
    }
  ]
}