{
  "version": 1,
  "display_name": "One ROM Slot Colour",
  "description": "Lights One ROM's RGB LED based on the booted ROM image",
  "author": "Piers Finlayson",
  "source": "https://github.com/piersfinlayson/one-rom",
  "license": "MIT",
  "latest": "0.1.0",
  "releases": [
    {
      "version": "0.1.0",
      "path": "v0.1.0",
      "filename": "plugin.bin",
      "sha256": "14de101da46630dafdd053d47eb2a75ad522373e915717fd728b6319e78fca41",
      "api_version": 1,
      "plugin_type": "user",
      "min_fw_version": "0.7.2"
    }
  ]
}