{
  "version": 1,
  "display_name": "One ROM USB",
  "description": "Adds live USB support to One ROM",
  "author": "Piers Finlayson",
  "source": "https://github.com/piersfinlayson/one-rom",
  "license": "MIT",
  "latest": "0.3.2",
  "releases": [
    {
      "version": "0.3.2",
      "path": "v0.3.2",
      "filename": "plugin.bin",
      "sha256": "86854e8b7ce5c705845501f87d6dec20c0597af5e039976a23b03d1a50222300",
      "api_version": 1,
      "plugin_type": "system",
      "min_fw_version": "0.8.0"
    },
    {
      "version": "0.3.1",
      "path": "v0.3.1",
      "filename": "plugin.bin",
      "sha256": "be941b5af5c6a420b5337e453c4914de001eabf16e356b8e837c59fc104939a0",
      "api_version": 1,
      "plugin_type": "system",
      "min_fw_version": "0.7.2"
    },
    {
      "version": "0.3.0",
      "path": "v0.3.0",
      "filename": "plugin.bin",
      "sha256": "22cb6e9082a126312b1b9bbc27fecefc9aa9414b2ced6c0df46d265df06d28a7",
      "api_version": 1,
      "plugin_type": "system",
      "min_fw_version": "0.7.2"
    },
    {
      "version": "0.2.1",
      "path": "v0.2.1",
      "filename": "plugin.bin",
      "sha256": "3a459b01452b0d47bbf5bcea41d85117bdadab07030bec444b47785af74437fd",
      "api_version": 1,
      "plugin_type": "system",
      "min_fw_version": "0.7.0",
      "incompatible_from": "0.7.2"
    },
    {
      "version": "0.2.0",
      "path": "v0.2.0",
      "filename": "plugin.bin",
      "sha256": "0f2015967719e26d537987b132474bf16d230895f9ab746a5eb307de3e3e67de",
      "api_version": 1,
      "plugin_type": "system",
      "min_fw_version": "0.7.0",
      "incompatible_from": "0.7.2"
    },
    {
      "version": "0.1.2",
      "path": "v0.1.2",
      "filename": "plugin.bin",
      "sha256": "3b6cb5b16ee298799e605b7f8716f320fd07fbdf3d403c9931390cd08b9b1f55",
      "api_version": 1,
      "plugin_type": "system",
      "min_fw_version": "0.6.9",
      "incompatible_from": "0.7.0"
    },
    {
      "version": "0.1.1",
      "path": "v0.1.1",
      "filename": "plugin.bin",
      "sha256": "6a06e3d4ca1497e7a651bbc030fec56d7e062df5b303669eeda4518754ed3f2a",
      "api_version": 1,
      "plugin_type": "system",
      "min_fw_version": "0.6.7",
      "incompatible_from": "0.7.0"
    },
    {
      "version": "0.1.0",
      "path": "v0.1.0",
      "filename": "plugin.bin",
      "sha256": "2fddddb8e2b28eb026ef2f070e1e75a473b0384bbf64753eb3b371459a8d69d9",
      "api_version": 1,
      "plugin_type": "system",
      "min_fw_version": "0.6.7",
      "incompatible_from": "0.7.0"
    }
  ]
}