{
  "version": 1,
  "display_name": "One ROM RGB",
  "description": "Drives One ROM's RGB neo-pixel (supported models only)",
  "author": "Piers Finlayson",
  "source": "https://github.com/piersfinlayson/one-rom",
  "license": "MIT",
  "latest": "0.1.2",
  "releases": [
    {
      "version": "0.1.2",
      "path": "v0.1.2",
      "filename": "plugin.bin",
      "sha256": "56a7a2af447d9a4c0037f802f44707caadbaab441d5d4efeb83a27715c195975",
      "api_version": 1,
      "plugin_type": "user",
      "min_fw_version": "0.7.1"
    },
    {
      "version": "0.1.1",
      "path": "v0.1.1",
      "filename": "plugin.bin",
      "sha256": "d4cc4ef989ada2e3982b1b45f2bb5755b259b3507d339a4b920b7cb6ea43ecf4",
      "api_version": 1,
      "plugin_type": "user",
      "min_fw_version": "0.6.7"
    },
    {
      "version": "0.1.0",
      "path": "v0.1.0",
      "filename": "plugin.bin",
      "sha256": "7468219d521b73d51d3629cb4d5b4f2f8959b349a459e1348c9ea9770e93fcd4",
      "api_version": 1,
      "plugin_type": "user",
      "min_fw_version": "0.6.7"
    }
  ]
}